query,id,timestamp_utc,local_time,user_screen_name,text,possibly_sensitive,retweet_count,like_count,reply_count,lang,to_username,to_userid,to_tweetid,source_name,source_url,user_location,lat,lng,user_id,user_name,user_verified,user_description,user_url,user_image,user_tweets,user_followers,user_friends,user_likes,user_lists,user_created_at,user_timestamp_utc,collected_via,match_query,retweeted_id,retweeted_user,retweeted_user_id,retweeted_timestamp_utc,quoted_id,quoted_user,quoted_user_id,quoted_timestamp_utc,collection_time,url,place_country_code,place_name,place_type,place_coordinates,links,domains,media_urls,media_files,media_types,mentioned_names,mentioned_ids,hashtags,intervention_type,intervention_text,intervention_url
abortion ireland min_retweets:1 until:2019-01-20 since:2018-12-21 -filter:replies,1083038045719412737,1547051366,2019-01-09T16:29:26,johnnetteb,"Majority of #Doctors Refuse to Perform #Abortions in #Ireland by Susan Brinkmann

Despite all the hype surrounding the repeal of Ireland’s abortion ban, the first week of legal abortion in that country found.... http://ht.ly/bBcE30nfvZn

#prolife #whywemarch #UniqueFromDayOne",0,1,12,0,en,,,,Hootsuite Inc.,https://www.hootsuite.com,Florida,,,41683232,Johnnette Benkovic Williams,0,"Host of Women of Grace Live Radio and Women of Grace Television on EWTN.  Catholic author, speaker and evangelist.  Daughter of God.",http://www.womenofgrace.com,https://pbs.twimg.com/profile_images/1259869236685615104/yvCYFiUb_normal.jpg,20303,12226,1060,3477,169,2009-05-21T21:32:50,1242941570,scraping,1,,,,,,,,,2022-03-28T13:57:09.104989,https://twitter.com/johnnetteb/statuses/1083038045719412737,,,,,http://ht.ly/bBcE30nfvZn,ht.ly,,,,,,abortions|doctors|ireland|prolife|uniquefromdayone|whywemarch,,,
abortion ireland min_retweets:1 until:2019-01-20 since:2018-12-21 -filter:replies,1083037863183351809,1547051323,2019-01-09T16:28:43,WomenOfGrace,"Majority of #Doctors Refuse to Perform #Abortions in #Ireland by @SueBrinkmann 

Despite all the hype surrounding the repeal of Ireland’s abortion ban, the first week of legal abortion in that country found.... http://ht.ly/bBcE30nfvZn 

#prolife #whywemarch #UniqueFromDayOne",0,0,1,0,en,,,,Hootsuite Inc.,https://www.hootsuite.com,Florida,,,67800927,Women of Grace,0,Women of Grace® seeks to transform the world one woman at a time by affirming women in gift of authentic femininity. #WomenofGrace,http://www.womenofgrace.com,https://pbs.twimg.com/profile_images/1140719799758180355/ztzj525i_normal.jpg,17650,7314,1233,359,79,2009-08-22T03:20:09,1250911209,scraping,1,,,,,,,,,2022-03-28T13:57:09.105669,https://twitter.com/WomenOfGrace/statuses/1083037863183351809,,,,,http://ht.ly/bBcE30nfvZn,ht.ly,,,,suebrinkmann,234833739,abortions|doctors|ireland|prolife|uniquefromdayone|whywemarch,,,
abortion ireland min_retweets:1 until:2019-01-20 since:2018-12-21 -filter:replies,1083017363623157761,1547046435,2019-01-09T15:07:15,TheKingDude,"Currently Discussing: The once formerly great Ireland -""Maybe the English have finally won - they're getting rid of the Irish."" How you may ask? Through #Abortion! #ProLife Tune into @VeritasRadioNet and join the conversation. Day 1, about 20 women decided to murder their babies. https://twitter.com/TheKingDude/status/1083017363623157761/photo/1",0,0,0,1,en,,,,Hootsuite Inc.,https://www.hootsuite.com,"New Orleans, LA",,,21657697,"Mike Church - White by Birth, Catholic by Grace!",0,Truth. Named Sources. Husband. King. Mentor to Future Radio Stars. Longest Running Radio Talk Show on Earth! ON-Air DAILY 6-10am! HERE: https://t.co/cnf4kPy9ZR,https://www.mikechurch.com,https://pbs.twimg.com/profile_images/1377041106941190147/HHkLNBJY_normal.jpg,65229,19774,2627,4094,359,2009-02-23T14:53:50,1235400830,scraping,1,,,,,,,,,2022-03-28T13:57:09.106664,https://twitter.com/TheKingDude/statuses/1083017363623157761,,,,,,,https://pbs.twimg.com/media/DwemjQiW0AIRFa3.jpg,1083017363623157761_DwemjQiW0AIRFa3.jpg,photo,veritasradionet,4452836555,abortion|prolife,,,
abortion ireland min_retweets:1 until:2019-01-20 since:2018-12-21 -filter:replies,1083015603101810690,1547046015,2019-01-09T15:00:15,ARK_info,ARK submitted written evidence to the @Commonswomequ Inquiry on abortion law in N Ireland.  http://data.parliament.uk/writtenevidence/committeeevidence.svc/evidencedocument/women-and-equalities-committee/abortion-law-in-northern-ireland/written/93701.pdf,0,1,0,1,en,,,,Twitter Web Client,http://twitter.com,Northern Ireland,,,33876029,ARK,0,ARK provides access to social and political information on Northern Ireland.  ARK is a joint initiative of @UlsterUni @QueensUBelfast,https://www.ark.ac.uk,https://pbs.twimg.com/profile_images/1058352568781422592/5B3MKFYo_normal.jpg,4838,3015,1648,3492,61,2009-04-21T11:25:44,1240313144,scraping,1,,,,,,,,,2022-03-28T13:57:09.107308,https://twitter.com/ARK_info/statuses/1083015603101810690,,,,,http://data.parliament.uk/writtenevidence/committeeevidence.svc/evidencedocument/women-and-equalities-committee/abortion-law-in-northern-ireland/written/93701.pdf,data.parliament.uk,,,,commonswomequ,3317681206,,,,
abortion ireland min_retweets:1 until:2019-01-20 since:2018-12-21 -filter:replies,1082997883513831425,1547041791,2019-01-09T13:49:51,Nurses4lifeIrl,Will Ireland see the extermination of babies diagnosed with Trisomy 21 if mothers say they can't cope mentally? @simonharristd @michealmartintd German man who survived abortion dies aged 21 https://www.irishtimes.com/news/world/europe/german-man-who-survived-abortion-dies-aged-21-1.3752247#.XDX7vhja2fM.twitter via @IrishTimesWorld,0,17,29,1,en,,,,Twitter Web Client,http://twitter.com,Ireland,,,965258232754311169,Nurses & Midwives 4Life Ireland,0,"Nurses & midwives who believe the unborn child, like her mother, has a right to life. https://t.co/IVqPwxsSvp…",https://m.facebook.com/Nurses4LifeIrl/?ref=bookmarks,https://pbs.twimg.com/profile_images/1058871860581023747/fWpiJkXm_normal.jpg,1629,1919,2503,324,13,2018-02-18T16:14:31,1518970471,scraping,1,,,,,,,,,2022-03-28T13:57:09.897597,https://twitter.com/Nurses4lifeIrl/statuses/1082997883513831425,,,,,https://www.irishtimes.com/news/world/europe/german-man-who-survived-abortion-dies-aged-21-1.3752247#.XDX7vhja2fM.twitter,irishtimes.com,,,,irishtimesworld|michealmartintd|simonharristd,1114319616|114007914|21117425,,,,
abortion ireland min_retweets:1 until:2019-01-20 since:2018-12-21 -filter:replies,1082991382489370625,1547040241,2019-01-09T13:24:01,RewireNewsGroup,"Abortion in #Ireland is now free, safe, and legal up to 12 weeks into pregnancy.

Can the rest of the world catch up now? 

https://rewirenews.link/2Ll8OxK",0,4,12,1,en,,,,Buffer,https://buffer.com,,,,14764240,Rewire News Group,1,"Home of @AngryBlackLady Chronicles, @Hegemommy, #BoomLawyered and The Fallout 📧 https://t.co/FG2Insi2fd",http://rewirenewsgroup.com,https://pbs.twimg.com/profile_images/1443242471471947781/XYrwIq24_normal.jpg,97894,83815,3211,28374,2294,2008-05-13T20:35:15,1210710915,scraping,1,,,,,,,,,2022-03-28T13:57:09.899537,https://twitter.com/RewireNewsGroup/statuses/1082991382489370625,,,,,https://rewirenews.link/2Ll8OxK,rewirenews.link,,,,,,ireland,,,
abortion ireland min_retweets:1 until:2019-01-20 since:2018-12-21 -filter:replies,1082978236483674112,1547037106,2019-01-09T12:31:46,paddymacc1,"German law allowed Tim to receive medical care post a failed abortion
sadly in Ireland @FineGael 
have voted to deny medical care to an Irish child born in similar circumstances

https://www.irishtimes.comc/news/world/europe/german-man-who-survived-abortion-dies-aged-21-1.3752247",,2,7,2,en,,,,Twitter for Android,http://twitter.com/download/android,#MeathEast,,,240721248,Paddy McKenna 🇮🇪,0,"I'm known by the name of Paddy, but if you need to know who I really am, well that's a different story.
I am NOT politically alligned, 
but I am socially aware",http://page.is/paddymacc1,https://pbs.twimg.com/profile_images/1495354328483303424/In-eK8fq_normal.jpg,38087,2966,4518,29943,2,2011-01-20T15:53:11,1295538791,scraping,1,,,,,,,,,2022-03-28T13:57:09.900322,https://twitter.com/paddymacc1/statuses/1082978236483674112,,,,,,,,,,finegael,19530527,,,,
abortion ireland min_retweets:1 until:2019-01-20 since:2018-12-21 -filter:replies,1082923280829435904,1547024004,2019-01-09T08:53:24,latinmassuk,"On Monday 7th Jan, the first abortion was scheduled in Ireland. What a sad day https://twitter.com/latinmassuk/status/1082923280829435904/photo/1",0,7,20,5,en,,,,Twitter for iPhone,http://twitter.com/download/iphone,London UK,,,3003292371,Latin Mass Society,0,An association of Catholics dedicated to promoting traditional Latin liturgy #latinmass,http://www.lms.org.uk,https://pbs.twimg.com/profile_images/565502697302794241/-DQc_J5h_normal.jpeg,5916,19578,1095,6462,156,2015-01-28T15:09:00,1422457740,scraping,1,,,,,,,,,2022-03-28T13:57:09.901472,https://twitter.com/latinmassuk/statuses/1082923280829435904,GB,"Redhill, South East",city,"[[-0.230949, 51.21315], [-0.130394, 51.21315], [-0.130394, 51.268978], [-0.230949, 51.268978]]",,,https://pbs.twimg.com/media/DwdQ-uEXQAA2dsI.jpg,1082923280829435904_DwdQ-uEXQAA2dsI.jpg,photo,,,,,,
abortion ireland min_retweets:1 until:2019-01-20 since:2018-12-21 -filter:replies,1082918235043975169,1547022801,2019-01-09T08:33:21,CllrJSimpson,Our first @VauxhallLabour women’s Forum last weekend where we passed a motion for the national Women’s Forum to discuss abortion rights for women in Northern Ireland https://twitter.com/CllrJSimpson/status/1082918235043975169/photo/1,0,1,9,0,en,,,,Twitter for iPad,http://twitter.com/#!/download/ipad,#SE11 #Kennington #Vauxhall ,,,428402346,Joanne Simpson,0,Lambeth Labour Councillor Prince's ward / May ‘22🌹candidate for Stockwell West & Larkhall 👋 #Vauxhall / Town Planner / 🚲🦔🐈 Email: jsimpson2@lambeth.gov.uk,,https://pbs.twimg.com/profile_images/1489526012551516162/tTKCsD_N_normal.jpg,12763,3634,4999,4968,98,2011-12-04T18:29:56,1323023396,scraping,1,,,,,,,,,2022-03-28T13:57:09.902648,https://twitter.com/CllrJSimpson/statuses/1082918235043975169,,,,,,,https://pbs.twimg.com/media/DwdMZEsXQAAQg17.jpg,1082918235043975169_DwdMZEsXQAAQg17.jpg,photo,vauxhalllabour,317827017,,,,
abortion ireland min_retweets:1 until:2019-01-20 since:2018-12-21 -filter:replies,1082913116797718528,1547021581,2019-01-09T08:13:01,LABailey,"A long, wise and thoughtful leader from The Guardian on Brexit, setting out why but also crucially how - based  on Ireland's experience with  abortion - this almighty mess must now be  addressed.

https://www.theguardian.com/commentisfree/2019/jan/08/the-guardian-view-on-brexit-the-government-has-failed-its-time-to-go-back-to-the-people?CMP=Share_AndroidApp_Tweet",0,3,2,0,en,,,,Twitter for Android,http://twitter.com/download/android,"Tunbridge Wells, England, UK",,,14810083,Lucy Bailey,0,"Producer on @BBCWorldService radio's Newshour. Background / interest in science, politics & law esp. international / human rights. NUJ MoC (trade union rep)",http://www.bbc.co.uk/programmes/p002vsnk,https://pbs.twimg.com/profile_images/972077513445920770/9-QFsFjF_normal.jpg,24556,1570,5001,38071,22,2008-05-17T11:51:26,1211025086,scraping,1,,,,,,,,,2022-03-28T13:57:09.903665,https://twitter.com/LABailey/statuses/1082913116797718528,,,,,https://www.theguardian.com/commentisfree/2019/jan/08/the-guardian-view-on-brexit-the-government-has-failed-its-time-to-go-back-to-the-people?CMP=Share_AndroidApp_Tweet,theguardian.com,,,,,,,,,
abortion ireland min_retweets:1 until:2019-01-20 since:2018-12-21 -filter:replies,1082902292649586688,1547019000,2019-01-09T07:30:00,Dazed,"Pro-choice activists fight back against Ireland’s anti-abortion protests:
https://www.dazeddigital.com/politics/article/42791/1/anti-choice-abortion-activists-galway-protest-ireland-clinics https://twitter.com/Dazed/status/1082902292649586688/photo/1",0,3,14,0,en,,,,TweetDeck,https://about.twitter.com/products/tweetdeck,London,,,15317676,Dazed,1,Where pop culture meets the underground.,http://www.dazeddigital.com,https://pbs.twimg.com/profile_images/1496187041972985857/4Yxrpt7i_normal.jpg,99674,1250754,10140,2891,9543,2008-07-04T13:38:25,1215178705,scraping,1,,,,,,,,,2022-03-28T13:57:09.904960,https://twitter.com/Dazed/statuses/1082902292649586688,,,,,https://www.dazeddigital.com/politics/article/42791/1/anti-choice-abortion-activists-galway-protest-ireland-clinics,dazeddigital.com,https://pbs.twimg.com/media/DwYmWkRXcAAaGU1.jpg,1082902292649586688_DwYmWkRXcAAaGU1.jpg,photo,,,,,,
abortion ireland min_retweets:1 until:2019-01-20 since:2018-12-21 -filter:replies,1082875492997517312,1547012611,2019-01-09T05:43:31,frbmcgrath,Catholic hospital may have performed Ireland’s first abortion | News | LifeSite https://www.lifesitenews.com/news/catholic-hospital-may-have-performed-irelands-first-abortion?utm_content=buffera220c,0,1,0,0,en,,,,Twitter Web Client,http://twitter.com,,,,384053876,Fr. Brendan McGrath,0,"I am a Self-Absorbed Promethean Neopelagian & Roman Catholic Priest in Ontario, Canada.  I block trolls and papolaters.",https://linktr.ee/frbrendanmcgrath,https://pbs.twimg.com/profile_images/1497278351790256140/-vKONtFh_normal.jpg,38580,3434,865,16,47,2011-10-03T00:27:22,1317601642,scraping,1,,,,,,,,,2022-03-28T13:57:09.905909,https://twitter.com/frbmcgrath/statuses/1082875492997517312,,,,,https://www.lifesitenews.com/news/catholic-hospital-may-have-performed-irelands-first-abortion,lifesitenews.com,,,,,,,,,
abortion ireland min_retweets:1 until:2019-01-20 since:2018-12-21 -filter:replies,1082858809893236741,1547008633,2019-01-09T04:37:13,Independent,'Ireland didn't vote for abortion for a select few – but that's exactly what's happening' https://www.independent.co.uk/voices/abortion-northern-ireland-republic-repeal-eighth-vote-referendum-family-planning-a8715276.html?utm_term=Autofeed&utm_medium=Social&utm_source=Twitter#Echobox=1546891882,0,3,8,0,en,,,,Echobox,https://www.echobox.com,"London, England",,,16973333,The Independent,1,"News, comment and features from The Independent. Try an ad-free experience with access to premium articles with our app: https://t.co/3cP3AmmEDy",http://independent.co.uk,https://pbs.twimg.com/profile_images/1500085652309917697/C6VhBAcV_normal.jpg,1244888,3702313,400,55,26226,2008-10-26T00:00:29,1224979229,scraping,1,,,,,,,,,2022-03-28T13:57:09.907709,https://twitter.com/Independent/statuses/1082858809893236741,,,,,https://www.independent.co.uk/voices/abortion-northern-ireland-republic-repeal-eighth-vote-referendum-family-planning-a8715276.html#Echobox=1546891882,independent.co.uk,,,,,,,,,
abortion ireland min_retweets:1 until:2019-01-20 since:2018-12-21 -filter:replies,1082840648791793665,1547004303,2019-01-09T03:25:03,LifeSite,Catholic hospital may have performed Ireland’s first abortion http://bit.ly/2C8JBCv https://twitter.com/LifeSite/status/1082840648791793665/photo/1,0,5,8,7,en,,,,Buffer,https://buffer.com,Canada | USA,,,18927538,LifeSiteNews.com,0,"Covering the most important life, faith, and family news. For all Catholic reporting: @LSNCatholic YouTube: https://t.co/t5FbkF4tr8",http://www.lifesitenews.com,https://pbs.twimg.com/profile_images/768529481543852032/_akhk_6A_normal.jpg,52191,56103,29242,161,859,2009-01-13T04:00:46,1231819246,scraping,1,,,,,,,,,2022-03-28T13:57:09.908775,https://twitter.com/LifeSite/statuses/1082840648791793665,,,,,http://bit.ly/2C8JBCv,bit.ly,https://pbs.twimg.com/media/DwcF1M7XQAIRLZV.jpg,1082840648791793665_DwcF1M7XQAIRLZV.jpg,photo,,,,,,
abortion ireland min_retweets:1 until:2019-01-20 since:2018-12-21 -filter:replies,1082823021386072064,1547000100,2019-01-09T02:15:00,Christinaofs,"Church Militant JMJ+ The 1st abortion in Our Lady of Lourdes Hospital is scheduled for today Jan 7th in the Republic of Ireland. Priest's in Drogheda have asked for prayers that the woman will have a change of heart overnight & not go through with the procedure.🙏🏻

😭 https://twitter.com/Christinaofs/status/1082823021386072064/photo/1",0,2,2,0,en,,,,Twitter Web Client,http://twitter.com,,,,1755362227,Christina,0,Order Franciscan Secular. Here I am LORD-fiat. Totus Tuus. John 3:16 and 6:53  🙏✝️🌹 PEACE be within you.  #ProtectionLawsForUnborn #AbortionIsMurder🇨🇦,,https://pbs.twimg.com/profile_images/968240949687214080/aL5O-fu-_normal.jpg,58315,5873,4443,42273,64,2013-09-07T16:19:35,1378570775,scraping,1,,,,,,,,,2022-03-28T13:57:09.909841,https://twitter.com/Christinaofs/statuses/1082823021386072064,CA,"Vaughan, Ontario",city,"[[-79.711527, 43.749761], [-79.420056, 43.749761], [-79.420056, 43.924448], [-79.711527, 43.924448]]",,,https://pbs.twimg.com/media/Dwb1TC5XcAEy2BY.jpg,1082823021386072064_Dwb1TC5XcAEy2BY.jpg,photo,,,,,,
abortion ireland min_retweets:1 until:2019-01-20 since:2018-12-21 -filter:replies,1082796622290083841,1546993806,2019-01-09T00:30:06,CatholicRegistr,"Ireland’s new #abortion law ‘must be resisted’, bishops say http://ow.ly/KkwA30neRij https://twitter.com/CatholicRegistr/status/1082796622290083841/photo/1",0,2,3,0,en,,,,Hootsuite Inc.,https://www.hootsuite.com,"Toronto, Ontario",,,326301956,Catholic Register,0,Canada’s Catholic news source since 1893.,http://www.catholicregister.org,https://pbs.twimg.com/profile_images/1149019945201745920/okF3zlaC_normal.jpg,50113,12178,2373,598,304,2011-06-29T18:05:25,1309370725,scraping,1,,,,,,,,,2022-03-28T13:57:09.910825,https://twitter.com/CatholicRegistr/statuses/1082796622290083841,,,,,http://ow.ly/KkwA30neRij,ow.ly,https://pbs.twimg.com/media/DwbdyewWkAQn190.jpg,1082796622290083841_DwbdyewWkAQn190.jpg,photo,,,abortion,,,
abortion ireland min_retweets:1 until:2019-01-20 since:2018-12-21 -filter:replies,1082792062909587457,1546992719,2019-01-09T00:11:59,NoalabortoChile,95% of Doctors in Ireland are Refusing to Kill Babies in Abortions https://www.lifenews.com/2019/01/07/95-of-doctors-in-ireland-are-refusing-to-kill-babies-in-abortions/,0,4,4,0,en,,,,Facebook,http://www.facebook.com/twitter,Chile,,,2718632034,No al aborto Chile,0,"Sin religión ni política, defensa de la vida siempre y sin condiciones. Exigimos redes de apoyo para cada mujer y sus hijo/as",https://www.facebook.com/noqueremosabortoenChile,https://pbs.twimg.com/profile_images/1026820057643593728/lR5SUSaA_normal.jpg,15878,6765,681,4008,44,2014-08-09T05:12:46,1407561166,scraping,1,,,,,,,,,2022-03-28T13:57:09.911531,https://twitter.com/NoalabortoChile/statuses/1082792062909587457,,,,,https://www.lifenews.com/2019/01/07/95-of-doctors-in-ireland-are-refusing-to-kill-babies-in-abortions/,lifenews.com,,,,,,,,,
abortion ireland min_retweets:1 until:2019-01-20 since:2018-12-21 -filter:replies,1082784278918893573,1546990863,2019-01-08T23:41:03,whel_a,..& to think Ireland's politicians voted AGAINST giving pain relief to late term abortions of BABIES..??? BARBARIC... « MailOnline: Belgium bans halal and kosher slaughter methods which see animals killed without being stunned first https://dailym.ai/2Fe30Ff — https://twitter.com/MailOnline/status/1082225103314841600 »,0,2,3,0,en,,,,Twitter for Android,http://twitter.com/download/android,,,,1000443288963485697,A.Whel,0,,,https://abs.twimg.com/sticky/default_profile_images/default_profile_normal.png,9810,98,200,4931,0,2018-05-26T18:27:22,1527359242,scraping,1,,,,,1082225103314841600,MailOnline,15438913,1546857546,2022-03-28T13:57:09.913432,https://twitter.com/whel_a/statuses/1082784278918893573,,,,,https://dailym.ai/2Fe30Ff|https://twitter.com/MailOnline/status/1082225103314841600,dailym.ai|twitter.com,,,,,,,,,
abortion ireland min_retweets:1 until:2019-01-20 since:2018-12-21 -filter:replies,1082780497665843201,1546989962,2019-01-08T23:26:02,nrlc,Only a tiny fraction of Irish GPs sign up to perform abortions    https://buff.ly/2F9MF5a       #Ireland #abortion https://twitter.com/nrlc/status/1082780497665843201/photo/1,0,2,4,0,en,,,,Buffer,https://buffer.com,"Washington, DC",,,22170482,National Right to Life,1,"The nation’s oldest & largest #prolife org with 50 state RTL affiliates and more than 3,000 local chapters. Led by @CarolTobias1",http://www.nrlc.org,https://pbs.twimg.com/profile_images/1829310351/NRLC-profile-pic_normal.jpg,28143,66007,2324,8501,732,2009-02-27T18:25:24,1235759124,scraping,1,,,,,,,,,2022-03-28T13:57:09.914444,https://twitter.com/nrlc/statuses/1082780497665843201,,,,,https://buff.ly/2F9MF5a,buff.ly,https://pbs.twimg.com/media/DwbPH8wWwAI_zyo.jpg,1082780497665843201_DwbPH8wWwAI_zyo.jpg,photo,,,abortion|ireland,,,
abortion ireland min_retweets:1 until:2019-01-20 since:2018-12-21 -filter:replies,1082769913935101958,1546987439,2019-01-08T22:43:59,SusanKnowles,95% of Doctors in Ireland are Refusing to Kill Babies in Abortions | http://LifeNews.com https://www.lifenews.com/2019/01/07/95-of-doctors-in-ireland-are-refusing-to-kill-babies-in-abortions/,0,3,5,0,en,,,,Twitter for iPhone,http://twitter.com/download/iphone,USA,,,18466375,SusanKnowles,0,"Stand For Truth Radio, https://t.co/1dSLQzvSS6, Holy Spirit Follower, host & former TheBlaze Contributor, https://t.co/ZMxOO24V5W",http://www.susanknowles.com,https://pbs.twimg.com/profile_images/1232801568023400449/IVYHs27V_normal.jpg,145095,9689,10211,63549,178,2008-12-30T02:03:54,1230602634,scraping,1,,,,,,,,,2022-03-28T13:57:09.915230,https://twitter.com/SusanKnowles/statuses/1082769913935101958,,,,,http://lifenews.com|https://www.lifenews.com/2019/01/07/95-of-doctors-in-ireland-are-refusing-to-kill-babies-in-abortions/,lifenews.com|lifenews.com,,,,,,,,,
abortion ireland min_retweets:1 until:2019-01-20 since:2018-12-21 -filter:replies,1082757502842953729,1546984479,2019-01-08T21:54:39,tolouglin,"#THEREALEVILKERMIT Kudos for not giving into... yeeash Kermit Gosnell, no relation to Kermit the Frog. 95% of Doctors in Ireland are Refusing to Kill Babies in Abortions https://www.lifenews.com/2019/01/07/95-of-doctors-in-ireland-are-refusing-to-kill-babies-in-abortions/#.XDUcFkanN6w.twitter",0,0,1,0,en,,,,Twitter Web Client,http://twitter.com,,,,2300247451,Teddy O'Louglin,0,,,https://pbs.twimg.com/profile_images/991448053293953024/tl96cGDU_normal.jpg,834,217,1452,14,2,2014-01-19T19:51:40,1390161100,scraping,1,,,,,,,,,2022-03-28T13:57:09.915929,https://twitter.com/tolouglin/statuses/1082757502842953729,,,,,https://www.lifenews.com/2019/01/07/95-of-doctors-in-ireland-are-refusing-to-kill-babies-in-abortions/#.XDUcFkanN6w.twitter,lifenews.com,,,,,,therealevilkermit,,,
abortion ireland min_retweets:1 until:2019-01-20 since:2018-12-21 -filter:replies,1082749470612353025,1546982564,2019-01-08T21:22:44,MNFamilyCouncil,"""Since abortions became legal on Jan. 1 in Ireland, fewer than 5 percent of doctors have told the government that they are willing to abort unborn babies.""
via @LifeNewsHQ 

https://bit.ly/2AA8s2f",0,6,15,0,en,,,,Twitter Web Client,http://twitter.com,"Minneapolis, MN",,,391609144,Minnesota Family Council,0,Minnesota Family Council is dedicated to strengthening families and advancing biblical truth in the public square. We love our great state! ❤️,http://www.mfc.org,https://pbs.twimg.com/profile_images/1136743504909148161/AkaQNDP8_normal.png,5567,846,723,235,22,2011-10-15T20:53:37,1318712017,scraping,1,,,,,,,,,2022-03-28T13:57:09.916535,https://twitter.com/MNFamilyCouncil/statuses/1082749470612353025,,,,,https://bit.ly/2AA8s2f,bit.ly,,,,lifenewshq,50434933,,,,
abortion ireland min_retweets:1 until:2019-01-20 since:2018-12-21 -filter:replies,1082742519501410306,1546980907,2019-01-08T20:55:07,ThomasMoreSoc,"Doctors, bishops express concerns as legal abortions begin in Ireland: https://catholicherald.co.uk/news/2019/01/04/doctors-bishops-express-concerns-as-legal-abortions-begin-in-ireland/ #ProLife #Ireland #ChooseLife",0,1,5,1,en,,,,Hootsuite Inc.,https://www.hootsuite.com,"Chicago, IL",,,1400063185,@ThomasMoreSoc,0,"Restoring respect in law for life, marriage, and religious liberty since 1997. We are a national not-for-profit law firm that provides pro-bono legal services.",http://www.thomasmoresociety.org,https://pbs.twimg.com/profile_images/1460360038468435970/zBq4Tic0_normal.jpg,5711,14303,269,215,131,2013-05-03T15:49:25,1367596165,scraping,1,,,,,,,,,2022-03-28T13:57:09.917154,https://twitter.com/ThomasMoreSoc/statuses/1082742519501410306,,,,,https://catholicherald.co.uk/news/2019/01/04/doctors-bishops-express-concerns-as-legal-abortions-begin-in-ireland/,catholicherald.co.uk,,,,,,chooselife|ireland|prolife,,,
abortion ireland min_retweets:1 until:2019-01-20 since:2018-12-21 -filter:replies,1082732969457000448,1546978630,2019-01-08T20:17:10,CatholicRegistr,"Ireland’s new #abortion law ‘must be resisted’, bishops say http://ow.ly/KkwA30neRij https://twitter.com/CatholicRegistr/status/1082732969457000448/photo/1",0,1,2,1,en,,,,Hootsuite Inc.,https://www.hootsuite.com,"Toronto, Ontario",,,326301956,Catholic Register,0,Canada’s Catholic news source since 1893.,http://www.catholicregister.org,https://pbs.twimg.com/profile_images/1149019945201745920/okF3zlaC_normal.jpg,50113,12178,2373,598,304,2011-06-29T18:05:25,1309370725,scraping,1,,,,,,,,,2022-03-28T13:57:09.917982,https://twitter.com/CatholicRegistr/statuses/1082732969457000448,,,,,http://ow.ly/KkwA30neRij,ow.ly,https://pbs.twimg.com/media/Dwaj5abW0AAFjPG.jpg,1082732969457000448_Dwaj5abW0AAFjPG.jpg,photo,,,abortion,,,
