query,id,timestamp_utc,local_time,user_screen_name,text,possibly_sensitive,retweet_count,like_count,reply_count,lang,to_username,to_userid,to_tweetid,source_name,source_url,user_location,lat,lng,user_id,user_name,user_verified,user_description,user_url,user_image,user_tweets,user_followers,user_friends,user_likes,user_lists,user_created_at,user_timestamp_utc,collected_via,match_query,retweeted_id,retweeted_user,retweeted_user_id,retweeted_timestamp_utc,quoted_id,quoted_user,quoted_user_id,quoted_timestamp_utc,collection_time,url,place_country_code,place_name,place_type,place_coordinates,links,domains,media_urls,media_files,media_types,mentioned_names,mentioned_ids,hashtags,intervention_type,intervention_text,intervention_url
abortion ireland min_retweets:1 until:2019-01-20 since:2018-12-21 -filter:replies,1079814358761435138,1546282779,2018-12-31T18:59:39,cpbyrne,"Its not over until abortion is ended in Ireland. « EmmaMurphy12150: Apparently the media would have us believe that the abortion debate is over & pro-life people should just sit back and accept the mass killing to begin tomorrow
No chance
It's only downhill from here for the pro-aborts once the horrors of this 'service' become clear. #NewYearsEve https://twitter.com/EmmaMurphy12150/status/1079724545664258048/photo/1 — https://twitter.com/EmmaMurphy12150/status/1079724545664258048 »",0,7,13,1,en,,,,Twitter for iPhone,http://twitter.com/download/iphone,"Bordeaux, France",,,23431193,Chris Byrne- ☘️✝️🙏📿 🇮🇪🇺🇦Pray for Peace,0,Concerned Catholic and Prolife. RTing doesnt mean support.,,https://pbs.twimg.com/profile_images/1500722898574708737/cvWUY_zW_normal.jpg,52077,521,929,31929,4,2009-03-09T12:54:43,1236603283,scraping,1,,,,,1079724545664258048,EmmaMurphy12150,768996117094752256,1546261366,2022-03-28T13:57:23.795730,https://twitter.com/cpbyrne/statuses/1079814358761435138,IE,"Fingal, Ireland",city,"[[-6.4757083, 53.3508617], [-5.9957316, 53.3508617], [-5.9957316, 53.6383337], [-6.4757083, 53.6383337]]",https://twitter.com/EmmaMurphy12150/status/1079724545664258048,twitter.com,https://pbs.twimg.com/media/DvvzRIdX0AAAxwM.jpg,1079724545664258048_DvvzRIdX0AAAxwM.jpg,photo,,,newyearseve,,,
abortion ireland min_retweets:1 until:2019-01-20 since:2018-12-21 -filter:replies,1079808440267169792,1546281368,2018-12-31T18:36:08,shar_nolan,"Seeing out the achievements of 2018 with the launch of abortion care services in Ireland tomorrow is a great end to the year.

The My Options freephone helpline (1800 828 010) is provided by the HSE and will be staffed by trained professional counsellors from 9am January 1st. https://twitter.com/shar_nolan/status/1079808440267169792/photo/1",0,9,23,0,en,,,,Twitter Web Client,http://twitter.com,Ireland,,,44120439,Shar,0,"Mobility-struggler | @Puca_Plays | Artist | @WestQueerArt | Activist | Socialist | Disabled | They/Them | Cyclist | Yes, being ill & gay is my whole personality",http://westqueerart.com,https://pbs.twimg.com/profile_images/1499081163767369729/JMF7hl_D_normal.jpg,69649,4701,3335,89622,55,2009-06-02T13:48:00,1243950480,scraping,1,,,,,,,,,2022-03-28T13:57:23.796745,https://twitter.com/shar_nolan/statuses/1079808440267169792,,,,,,,https://pbs.twimg.com/media/Dvw_bDaWwAAqpHH.jpg,1079808440267169792_Dvw_bDaWwAAqpHH.jpg,photo,,,,,,
abortion ireland min_retweets:1 until:2019-01-20 since:2018-12-21 -filter:replies,1079794672778821632,1546278086,2018-12-31T17:41:26,FintanYTWalsh,"Tomorrow morning, I will be publishing an in-depth and very informative Q&A on everything you need to know about Ireland's abortion services, via @Limerick_Leader. Please feel free to ask questions in the meantime.",,2,10,0,en,,,,Twitter Web Client,http://twitter.com,Ireland,,,255705264,Fintan Walsh 🇺🇦,1,I am a health communicator and journalist in Ireland 🦠 Currently working with charities in Ukraine during invasion 🇺🇦 Media literacy geek. Views are my own.,,https://pbs.twimg.com/profile_images/1488230023530172419/jIYYEwK-_normal.jpg,15222,12094,7278,2259,91,2011-02-21T22:13:25,1298326405,scraping,1,,,,,,,,,2022-03-28T13:57:23.797346,https://twitter.com/FintanYTWalsh/statuses/1079794672778821632,,,,,,,,,,limerick_leader,21646017,,,,
abortion ireland min_retweets:1 until:2019-01-20 since:2018-12-21 -filter:replies,1079784391356940288,1546275634,2018-12-31T17:00:34,18_a_Day,6pm: Another woman travels from Ireland to get abortion care abroad. #RepealedThe8th #VotedYes #trustWomen #repealed #togetherForYes,,1,0,0,en,,,,Repeal,http://www.ireland.com,Ireland,,,996894663809396736,18aDay,0,"January 1980 to December 2016, at least 170,216 women/girls left Republic of Ireland to access abortion services.
Made with ❤️ by @mammydiaries @jimmyendless",http://www.togetherforyes.ie,https://pbs.twimg.com/profile_images/996903151780458501/vg2EwnVL_normal.jpg,4134,44,153,79,0,2018-05-16T23:26:24,1526513184,scraping,1,,,,,,,,,2022-03-28T13:57:23.797953,https://twitter.com/18_a_Day/statuses/1079784391356940288,,,,,,,,,,,,repealed|repealedthe8th|togetherforyes|trustwomen|votedyes,,,
abortion ireland min_retweets:1 until:2019-01-20 since:2018-12-21 -filter:replies,1079772988009074689,1546272916,2018-12-31T16:15:16,mikecoulson48,Email Minister for Women and Equalities to urge her to end the life time prison sentence for abortion in Northern Ireland https://www.thepetitionsite.com/tell-a-friend/59116950,0,9,7,0,en,,,,Twitter Web Client,http://twitter.com,North Yorkshire ,,,2476843155,Mani Isna La #NativeLivesMatter 🇵🇸 🇨🇺🕊,0,Septuagenarian Corbyn supporter. ex-Labour. Unite community. NHS/999 services. Indy Lifeboats. Water Safety. Animal welfare. Homelessness. Human Rights,http://thephilosophicalmuse.wordpress.com,https://pbs.twimg.com/profile_images/1094912061803507712/WBhFW7Fm_normal.jpg,653899,25844,20315,54543,270,2014-04-11T18:37:22,1397241442,scraping,1,,,,,,,,,2022-03-28T13:57:23.799046,https://twitter.com/mikecoulson48/statuses/1079772988009074689,,,,,https://www.thepetitionsite.com/tell-a-friend/59116950,thepetitionsite.com,,,,,,,,,
abortion ireland min_retweets:1 until:2019-01-20 since:2018-12-21 -filter:replies,1079762390223335424,1546270389,2018-12-31T15:33:09,SqueeFox,I’m a little in shock ?? Tomorrow ?? Abortion is legal in Ireland. Tomorrow it is available in Ireland !! Here !! We DID that !!!,,2,42,0,en,,,,Twitter for iPhone,http://twitter.com/download/iphone,She/They,,,1055466968,Saoirse 🌱,0,23 / Irish / Character Designer / Concept Artist / Vegan / 🏳️‍🌈,https://linktr.ee/Squeefox,https://pbs.twimg.com/profile_images/1464310717016911874/91y7VOok_normal.jpg,73784,3010,829,13095,14,2013-01-02T16:08:17,1357142897,scraping,1,,,,,,,,,2022-03-28T13:57:23.799649,https://twitter.com/SqueeFox/statuses/1079762390223335424,,,,,,,,,,,,,,,
abortion ireland min_retweets:1 until:2019-01-20 since:2018-12-21 -filter:replies,1079747809564340224,1546266913,2018-12-31T14:35:13,donegalprolife,"41,000,000 Forty One Million killed by #Abortion in 2018 , now in less than a few hours @SimonHarrisTD will add to this number , the Killing Fields will soon begin in #Ireland when innocent children with no say will Die https://www.breitbart.com/health/2018/12/31/abortion-leading-cause-of-death-in-2018-with-41-million-killed/",0,4,10,1,en,,,,Twitter for iPhone,http://twitter.com/download/iphone,"Donegal, Ireland",,,972490577701933057,DonegalAlive,0,Let’s Make This World A Better Place,,https://pbs.twimg.com/profile_images/1361756364213780480/VyigWsGd_normal.jpg,1916,713,391,921,5,2018-03-10T15:13:16,1520694796,scraping,1,,,,,,,,,2022-03-28T13:57:23.800306,https://twitter.com/donegalprolife/statuses/1079747809564340224,,,,,https://www.breitbart.com/health/2018/12/31/abortion-leading-cause-of-death-in-2018-with-41-million-killed/,breitbart.com,,,,simonharristd,21117425,abortion|ireland,,,
abortion ireland min_retweets:1 until:2019-01-20 since:2018-12-21 -filter:replies,1079739918660849664,1546265031,2018-12-31T14:03:51,TheLancet,"The shadow of #Brexit loomed over UK health systems, #cannabis was legalised in Canada, Ireland legalised #abortion, and violence continued to impede health care. 2018: a Year in Review https://hubs.ly/H0f_h-x0",0,12,14,0,en,,,,HubSpot,http://www.hubspot.com/,"London, New York, Beijing",,,27013292,The Lancet,1,"Keep in touch with The Lancet, one of the world's leading medical journals, published weekly since 1823. #FutureChild",http://thelancet.com,https://pbs.twimg.com/profile_images/378800000725668351/16bf102fc319d621a456d9f821071253_normal.jpeg,20548,708759,364,7101,8974,2009-03-27T14:24:45,1238163885,scraping,1,,,,,,,,,2022-03-28T13:57:23.800986,https://twitter.com/TheLancet/statuses/1079739918660849664,,,,,https://hubs.ly/H0f_h-x0,hubs.ly,,,,,,abortion|brexit|cannabis,,,
abortion ireland min_retweets:1 until:2019-01-20 since:2018-12-21 -filter:replies,1079735577862434817,1546263996,2018-12-31T13:46:36,Sharrow_irl,From tomorrow I will be able to for the first time in 25 years be able to give information on having a #freesafelegal abortion in Ireland. I can give out this phone number 1800 828 010.,,7,44,1,en,,,,Twitter for Android,http://twitter.com/download/android,"Dublin, Ireland",,,14394248,Janet Ní Shúilleabháin (vaxxed) 🇮🇪 🇪🇺🏳️‍🌈🦄,0,"Omninerd, infovore, AntiFascist, GenX, White/cis/bi/sí/í. If I can't have My Reproductive Rights then it's not My Revolution. #wearamask #vaccinated",http://www.Janet.ie,https://pbs.twimg.com/profile_images/1489403750917844995/D2qbWIDX_normal.jpg,253601,6454,3432,153694,261,2008-04-15T07:51:04,1208245864,scraping,1,,,,,,,,,2022-03-28T13:57:23.801608,https://twitter.com/Sharrow_irl/statuses/1079735577862434817,,,,,,,,,,,,freesafelegal,,,
abortion ireland min_retweets:1 until:2019-01-20 since:2018-12-21 -filter:replies,1079734141950873600,1546263654,2018-12-31T13:40:54,Sharrow_irl,Abortion Service in Ireland http://aimsireland.ie/abortion-service-in-ireland/ via @AIMSIreland #freesafelegal,1,1,1,0,en,,,,Twitter for Android,http://twitter.com/download/android,"Dublin, Ireland",,,14394248,Janet Ní Shúilleabháin (vaxxed) 🇮🇪 🇪🇺🏳️‍🌈🦄,0,"Omninerd, infovore, AntiFascist, GenX, White/cis/bi/sí/í. If I can't have My Reproductive Rights then it's not My Revolution. #wearamask #vaccinated",http://www.Janet.ie,https://pbs.twimg.com/profile_images/1489403750917844995/D2qbWIDX_normal.jpg,253601,6454,3432,153694,261,2008-04-15T07:51:04,1208245864,scraping,1,,,,,,,,,2022-03-28T13:57:23.802289,https://twitter.com/Sharrow_irl/statuses/1079734141950873600,,,,,http://aimsireland.ie/abortion-service-in-ireland/,aimsireland.ie,,,,aimsireland,264983377,freesafelegal,,,
abortion ireland min_retweets:1 until:2019-01-20 since:2018-12-21 -filter:replies,1079733914699223040,1546263600,2018-12-31T13:40:00,thejournal_ie,Timeline: The history of abortion and the Eighth Amendment in Ireland http://jrnl.ie/4382738t,0,3,5,2,en,,,,TweetDeck,https://about.twitter.com/products/tweetdeck,Ireland,,,150246405,TheJournal.ie,1,"Providing open access to valuable journalism | Support our work so we can keep questioning, debunking, explaining and informing https://t.co/yrQeirmt7y",http://thejournal.ie/,https://pbs.twimg.com/profile_images/1432677436605534211/U1YUGebe_normal.jpg,311513,698448,748,353,2451,2010-05-31T13:08:52,1275311332,scraping,1,,,,,,,,,2022-03-28T13:57:23.803823,https://twitter.com/thejournal_ie/statuses/1079733914699223040,,,,,http://jrnl.ie/4382738t,jrnl.ie,,,,,,,,,
abortion ireland min_retweets:1 until:2019-01-20 since:2018-12-21 -filter:replies,1079732157734633472,1546263181,2018-12-31T13:33:01,LiveActionNews,"Former Planned Parenthood prez calls new Ireland abortion law ""thrilling."" https://hubs.ly/H0g0MDc0",0,2,1,0,en,,,,HubSpot,http://www.hubspot.com/,United States,,,40623989,Live Action News,0,The Reporting Arm of @LiveAction Covering Pro-life & Human Rights News,http://LiveActionNews.org,https://pbs.twimg.com/profile_images/1228082724906266626/3nVY86Sd_normal.jpg,53584,30745,5282,397,340,2009-05-17T07:19:19,1242544759,scraping,1,,,,,,,,,2022-03-28T13:57:23.804457,https://twitter.com/LiveActionNews/statuses/1079732157734633472,,,,,https://hubs.ly/H0g0MDc0,hubs.ly,,,,,,,,,
abortion ireland min_retweets:1 until:2019-01-20 since:2018-12-21 -filter:replies,1079723489647570944,1546261114,2018-12-31T12:58:34,AmnestyIreland,"This year Ireland said 'yes'  to abortion rights – let's make 2019 the year other countries do too, @sorchatunney blogs https://www.huffingtonpost.co.uk/entry/ireland-abortion-referendum_uk_5c24aab3e4b08aaf7a8de8b1?ncid=other_twitter_cooo9wqtham&utm_campaign=share_twitter",0,10,19,2,en,,,,Twitter for iPhone,http://twitter.com/download/iphone,"Dublin, Ireland",,,16309025,Amnesty Ireland,1,"Ireland's largest human rights organisation, 20,000 strong. Freedom. Justice. Equality. Let's get to work!",http://www.amnesty.ie,https://pbs.twimg.com/profile_images/1503340956556345345/jNgsBDXe_normal.png,19628,34411,4612,6628,531,2008-09-16T10:24:40,1221560680,scraping,1,,,,,,,,,2022-03-28T13:57:24.681078,https://twitter.com/AmnestyIreland/statuses/1079723489647570944,,,,,https://www.huffingtonpost.co.uk/entry/ireland-abortion-referendum_uk_5c24aab3e4b08aaf7a8de8b1,huffingtonpost.co.uk,,,,sorchatunney,1669883222,,,,
abortion ireland min_retweets:1 until:2019-01-20 since:2018-12-21 -filter:replies,1079708836225785857,1546257621,2018-12-31T12:00:21,NMSGib,We’ve shared in your joy over the monumental leap forward for Ireland and dared to hope for #Gibraltar. We are here today because of you guys. Thank you! @fdelond @maraclarke @AbortionSupport @Abortion_Rights @DianaJohnsonMP @bpas1968 @Choicegibralta1,,3,18,0,en,,,,Twitter for iPhone,http://twitter.com/download/iphone,Gibraltar,,,1042103351813582851,No More Shame Gib.,0,Registered charity furthering women’s rights and access to a full sexual reproductive health service as advocated by the WHO and the UN. NMSgib@outlook.com,,https://pbs.twimg.com/profile_images/1180359324306198528/x8oVM1jH_normal.jpg,1100,428,484,1593,0,2018-09-18T17:29:35,1537291775,scraping,1,,,,,,,,,2022-03-28T13:57:24.681916,https://twitter.com/NMSGib/statuses/1079708836225785857,,,,,,,,,,abortion_rights|abortionsupport|bpas1968|choicegibralta1|dianajohnsonmp|fdelond|maraclarke,218535509|50308435|245742024|1012433227712221190|68659708|23397027|25466744,gibraltar,,,
abortion ireland min_retweets:1 until:2019-01-20 since:2018-12-21 -filter:replies,1079676235960250368,1546249848,2018-12-31T09:50:48,HPUKPersonal,"This year Ireland said 'yes'  to abortion rights – let's make 2019 the year other countries do too, @sorchatunney blogs http://huffp.st/5ai5vJ5",0,1,3,0,en,,,,SocialFlow,http://www.socialflow.com,London,,,329121956,HuffPost UK Personal,0,"Compelling, first-person storytelling from HuffPost UK. Have something to say? Click below or pitch us on ukpersonal@huffpost.com",https://www.huffingtonpost.co.uk/entry/how-to-pitch-huffpost-uk-personal_uk_5d1c8f65e4b03d611644e815,https://pbs.twimg.com/profile_images/1267785245790662658/fP9zVx9s_normal.jpg,5706,18765,790,27,361,2011-07-04T15:39:21,1309793961,scraping,1,,,,,,,,,2022-03-28T13:57:24.682769,https://twitter.com/HPUKPersonal/statuses/1079676235960250368,,,,,http://huffp.st/5ai5vJ5,huffp.st,,,,sorchatunney,1669883222,,,,
abortion ireland min_retweets:1 until:2019-01-20 since:2018-12-21 -filter:replies,1079674241161850880,1546249373,2018-12-31T09:42:53,Irishprolifer,"""Roscommon and Sligo are the two counties in Ireland which will not be providing abortion services from Tuesday.""   

https://extra.ie/2018/12/30/news/irish-news/revealed-the-two-counties-that-wont-have-abortion-services-in-new-year?utm_source=facebook&utm_medium=Social&utm_campaign=SocialWarfare",0,13,33,4,en,,,,Twitter for Android,http://twitter.com/download/android,Belgium,,,932100956,𝕻𝖗𝖔𝖑𝖎𝖋𝖊🙏𝕴𝖗𝖊𝖑𝖆𝖓𝖉,0,"#Catholic✝🙏🕊 #Prolife 👣 #Irish 🇮🇪 #Mum to boys #ProBaby🍼#ProFamily 
#Breastcancersurvivor 
#NoahsArmy💙

Views my own; 
RT is not an endorsement",,https://pbs.twimg.com/profile_images/1507102328033263624/MYZ7c9bw_normal.jpg,126003,7295,8013,131551,63,2012-11-07T13:50:52,1352296252,scraping,1,,,,,,,,,2022-03-28T13:57:24.684269,https://twitter.com/Irishprolifer/statuses/1079674241161850880,,,,,https://extra.ie/2018/12/30/news/irish-news/revealed-the-two-counties-that-wont-have-abortion-services-in-new-year,extra.ie,,,,,,,,,
abortion ireland min_retweets:1 until:2019-01-20 since:2018-12-21 -filter:replies,1079670409023369217,1546248459,2018-12-31T09:27:39,JoannaJ_Ireland,"PRAYER WARRIORS NEEDED: Brave people are needed to pray  regularly around these Abortion hospitals. DM me if you want to be part of this movement. God Bless Joanna J.#prolife,#prayer",,10,18,2,en,,,,Twitter Web Client,http://twitter.com,,,,963022867725258758,Joanna Dan,0,"Artist, Writer. I use the Ten Commandments of God, given to Moses on Mount Sinai, as my Moral Compass.",,https://pbs.twimg.com/profile_images/999637376115736577/ziTSyJnc_normal.jpg,446,129,0,7,0,2018-02-12T12:11:58,1518437518,scraping,1,,,,,,,,,2022-03-28T13:57:24.685018,https://twitter.com/JoannaJ_Ireland/statuses/1079670409023369217,,,,,,,,,,,,prayer|prolife,,,
abortion ireland min_retweets:1 until:2019-01-20 since:2018-12-21 -filter:replies,1079590468894232577,1546229400,2018-12-31T04:10:00,CatholicNewsSvc,"Although Ireland's new #abortion law takes effect Jan. 1, by mid-December only 8 percent of family doctors had signed up to provide the terminations. https://bit.ly/2AkYQs4 Our story via @NCRonline #prolife https://twitter.com/CatholicNewsSvc/status/1079590468894232577/photo/1",0,4,9,1,en,,,,TweetDeck,https://about.twitter.com/products/tweetdeck,"Washington, DC",,,17136419,Catholic News Service,1,"Catholic News Service is a leader in religious news.
Our mission is to report fully, fairly and freely on the involvement of the church in the world today.",http://www.catholicnews.com,https://pbs.twimg.com/profile_images/458694809314541568/jPMrNEsB_normal.jpeg,123316,202612,1157,16719,2816,2008-11-03T18:38:01,1225737481,scraping,1,,,,,,,,,2022-03-28T13:57:24.686279,https://twitter.com/CatholicNewsSvc/statuses/1079590468894232577,,,,,https://bit.ly/2AkYQs4,bit.ly,https://pbs.twimg.com/media/DvrVAR9X0AICC3I.jpg,1079590468894232577_DvrVAR9X0AICC3I.jpg,photo,ncronline,25146372,abortion|prolife,,,
abortion ireland min_retweets:1 until:2019-01-20 since:2018-12-21 -filter:replies,1079586877458575360,1546228543,2018-12-31T03:55:43,MinneEighty7,"Written by someone who previously celebrated 'the Yes vote' in Ireland. Sadly, too late #togetherforyes #abortion #ireland #repeal #the8th 
https://uk.style.yahoo.com/just-because-had-abortion-doesn-061500005.html?guccounter=1 https://twitter.com/MinneEighty7/status/1079586877458575360/photo/1",0,7,7,1,en,,,,Twitter Web App,https://mobile.twitter.com,"London, England",,,986184767577165824,Minne Eightyseven,0,#loveboth #abortion #feminism #women #postabortionsyndrome Been through abortion recently and still in the aftermath. Abortion hurts women.,,https://pbs.twimg.com/profile_images/986185586275909633/YWstZUer_normal.jpg,824,180,162,3682,1,2018-04-17T10:09:05,1523959745,scraping,1,,,,,,,,,2022-03-28T13:57:24.687613,https://twitter.com/MinneEighty7/statuses/1079586877458575360,,,,,https://uk.style.yahoo.com/just-because-had-abortion-doesn-061500005.html,uk.style.yahoo.com,https://pbs.twimg.com/media/Dvt2iQbX4AAHmuP.jpg,1079586877458575360_Dvt2iQbX4AAHmuP.jpg,photo,,,abortion|ireland|repeal|the8th|togetherforyes,,,
abortion ireland min_retweets:1 until:2019-01-20 since:2018-12-21 -filter:replies,1079547328057524225,1546219114,2018-12-31T01:18:34,RockofLifeNI,"Ireland's Anti Life #prochoice Feminists #repealedThe8th to have  ""control over their own bodies"". I don't see ANY of them speaking up to object to the bill that will allow underage girls who can now have abortions & leaving them open to Abuse. #hypocrisy « paddymacc1: Oh, the hypocricy & obfuscation

In Ireland now, due entirely to the recent abortion legislation a 15 year old girl can have an abortion without parental consent, but if same girl presents to dentist for a tooth extraction she cannot have that treatment, without parental consent https://twitter.com/paddymacc1/status/1077875904028786688/photo/1 — https://twitter.com/paddymacc1/status/1077875904028786688 »",0,15,20,0,en,,,,Twitter for Android,http://twitter.com/download/android,Northern Ireland ,,,186588342,ᵁⁿᵇᵒʳⁿ ᴸⁱᵛᵉˢ ᴹᵃᵗᵗᵉʳ,0,"ɪ'ʟʟ ʜᴀᴠᴇ ᴀ ʟᴏᴛ ᴏꜰ ᴇxᴘʟᴀɪɴɪɴɢ ᴛᴏ ᴅᴏ ᴏɴ ᴊᴜᴅɢᴇᴍᴇɴᴛ ᴅᴀʏ, ʙᴜᴛ ᴠᴏᴛɪɴɢ ꜰᴏʀ ᴘᴏʟɪᴛɪᴄɪᴀɴꜱ ᴡʜᴏ ꜱᴜᴘᴘᴏʀᴛ ᴀʙᴏʀᴛɪᴏɴ ᴡᴏɴ'ᴛ ʙᴇ ᴏɴᴇ ᴏꜰ ᴛʜᴇᴍ. #RepealSection9 #VoteProlife #AE22",,https://pbs.twimg.com/profile_images/1504594149303009282/XkvXu63q_normal.jpg,37159,3763,4964,41401,22,2010-09-03T21:26:59,1283549219,scraping,1,,,,,1077875904028786688,paddymacc1,240721248,1545820616,2022-03-28T13:57:24.690208,https://twitter.com/RockofLifeNI/statuses/1079547328057524225,,,,,https://twitter.com/paddymacc1/status/1077875904028786688,twitter.com,https://pbs.twimg.com/media/DvViZ4sWkAAnCon.jpg|https://pbs.twimg.com/media/DvViae_WsAAR7Q8.jpg,1077875904028786688_DvViZ4sWkAAnCon.jpg|1077875904028786688_DvViae_WsAAR7Q8.jpg,photo|photo,,,hypocrisy|prochoice|repealedthe8th,,,
abortion ireland min_retweets:1 until:2019-01-20 since:2018-12-21 -filter:replies,1079542958817509376,1546218072,2018-12-31T01:01:12,CatholicGKCSoc,"Please say the GK Chesterton prayer today for the end of abortion in this Country & especially for the abortion centres in Twickenham, Ealing, Whitfield St, St Mary’s St & Edgbaston to close down by the end of 2018 & for no abortions to happen in Ireland; https://www.catholicgkchestertonsociety.co.uk/Printable-Prayercards.html https://twitter.com/CatholicGKCSoc/status/1079542958817509376/photo/1",0,8,6,2,en,,,,Twitter for Android,http://twitter.com/download/android,"Beaconsfield, England",,,761223092358316032,Catholic Chesterton,0,Catholic GK Chesterton Society locally based in England and on Facebook https://t.co/fxiQJTs4vi,http://www.catholicgkchestertonsociety.co.uk,https://pbs.twimg.com/profile_images/1430665995631407108/KRO83ffz_normal.jpg,9603,2107,87,3844,24,2016-08-04T15:31:42,1470324702,scraping,1,,,,,,,,,2022-03-28T13:57:24.691320,https://twitter.com/CatholicGKCSoc/statuses/1079542958817509376,,,,,https://www.catholicgkchestertonsociety.co.uk/Printable-Prayercards.html,catholicgkchestertonsociety.co.uk,https://pbs.twimg.com/media/DvtOjusXQAAJsIp.jpg,1079542958817509376_DvtOjusXQAAJsIp.jpg,photo,,,,,,
abortion ireland min_retweets:1 until:2019-01-20 since:2018-12-21 -filter:replies,1079538996856918016,1546217128,2018-12-31T00:45:28,marlowsean,"Just saw Farage being interviewed on Euronews. He said ""The Irish border is not a problem . . . there already is a difference in abortion laws in the 2 parts of Ireland"" Interviewer: ""There is a difference in abortion laws between N Ireland and Britain!"" https://twitter.com/marlowsean/status/1079538996856918016/photo/1",0,1,1,0,en,,,,Twitter Web Client,http://twitter.com,,,,39531321,Sean Marlow,0,,,https://pbs.twimg.com/profile_images/217069959/Sean-Dan_despecld_normal.jpg,54745,1434,568,292653,3,2009-05-12T16:10:05,1242144605,scraping,1,,,,,,,,,2022-03-28T13:57:24.692234,https://twitter.com/marlowsean/statuses/1079538996856918016,IE,"Dublin City, Ireland",city,"[[-6.387438, 53.2987449], [-6.1078047, 53.2987449], [-6.1078047, 53.4110598], [-6.387438, 53.4110598]]",,,https://pbs.twimg.com/media/DvtK-CJXQAAZSnI.jpg,1079538996856918016_DvtK-CJXQAAZSnI.jpg,photo,,,,,,
abortion ireland min_retweets:1 until:2019-01-20 since:2018-12-21 -filter:replies,1079525746811359232,1546213969,2018-12-30T23:52:49,feminist_law,"From 1 January 2019 abortions in Ireland will be legal and free of charge 
https://www.stuff.co.nz/world/europe/109494453/universal-free-abortion-for-republic-of-ireland?cid=facebook.post.109494453",0,1,3,0,en,,,,Twitter for iPhone,http://twitter.com/download/iphone,,,,862193618936676352,Feminist Legal Group,0,🏳️‍🌈The Monash feminist legal studies group. Making a difference to the lives of women through understanding ♀subordination & contributing to law reform🏳️‍🌈,https://www.monash.edu/law/research/research-groups/feminist-legal-studies-group,https://pbs.twimg.com/profile_images/862198054450978816/jplNgIFG_normal.jpg,3692,1419,1530,831,12,2017-05-10T06:32:32,1494397952,scraping,1,,,,,,,,,2022-03-28T13:57:24.692940,https://twitter.com/feminist_law/statuses/1079525746811359232,,,,,https://www.stuff.co.nz/world/europe/109494453/universal-free-abortion-for-republic-of-ireland?cid=facebook.post.109494453,stuff.co.nz,,,,,,,,,
abortion ireland min_retweets:1 until:2019-01-20 since:2018-12-21 -filter:replies,1079510556221030400,1546210347,2018-12-30T22:52:27,Leitrim4Choice,"This piece neglects to mention that women in Ireland have been having abortions since the dawn of recorded history and well before that.
https://www.thejournal.ie/abortion-in-ireland-4382738-Dec2018/",0,4,16,1,en,,,,Twitter Web Client,http://twitter.com,"Leitrim, Ireland",,,773112030094094340,Leitrim for Choice,0,"Abortion, on demand and without apology, in Lovely Leitrim & worldwide. 
Reproductive justice is a human right.",https://leitrimforchoice.ie/,https://pbs.twimg.com/profile_images/1476902752995450885/EzHDTBn6_normal.jpg,11167,1928,1382,10428,31,2016-09-06T10:54:06,1473159246,scraping,1,,,,,,,,,2022-03-28T13:57:24.693642,https://twitter.com/Leitrim4Choice/statuses/1079510556221030400,,,,,https://www.thejournal.ie/abortion-in-ireland-4382738-Dec2018/,thejournal.ie,,,,,,,,,
