query,id,timestamp_utc,local_time,user_screen_name,text,possibly_sensitive,retweet_count,like_count,reply_count,lang,to_username,to_userid,to_tweetid,source_name,source_url,user_location,lat,lng,user_id,user_name,user_verified,user_description,user_url,user_image,user_tweets,user_followers,user_friends,user_likes,user_lists,user_created_at,user_timestamp_utc,collected_via,match_query,retweeted_id,retweeted_user,retweeted_user_id,retweeted_timestamp_utc,quoted_id,quoted_user,quoted_user_id,quoted_timestamp_utc,collection_time,url,place_country_code,place_name,place_type,place_coordinates,links,domains,media_urls,media_files,media_types,mentioned_names,mentioned_ids,hashtags,intervention_type,intervention_text,intervention_url
abortion ireland min_retweets:1 until:2019-01-20 since:2018-12-21 -filter:replies,1086767909093937152,1547940635,2019-01-19T23:30:35,TarynDeVere,"Incredible what a bunch of feminists can achieve in less than 6 years. Even 2 years ago no one imagined we'd have free, safe, legal abortion in Ireland by 2019. We're powerful.✊ « Bubblenoma: ARC is 6 years old today https://twitter.com/freesafelegal/status/954291730114842624 — https://twitter.com/Bubblenoma/status/1086755445191180288 »",0,3,46,0,en,,,,Twitter for Android,http://twitter.com/download/android,Ireland,,,756922710500999170,Taryn de Vere,0,"*possibly* the Most Colourful Woman in Ireland. Artist, Writer, Joy Bringer. She/her. Agent: @armodelagency

☕ https://t.co/fliK0LdGUf",https://linktr.ee/Taryn_de_Vere,https://pbs.twimg.com/profile_images/1478507823084548102/N7_fUFHf_normal.jpg,80351,27598,6033,287632,100,2016-07-23T18:43:31,1469299411,scraping,1,,,,,1086755445191180288,Bubblenoma,248668138,1547937663,2022-03-28T13:57:02.535647,https://twitter.com/TarynDeVere/statuses/1086767909093937152,,,,,https://twitter.com/Bubblenoma/status/1086755445191180288|https://twitter.com/freesafelegal/status/954291730114842624,twitter.com|twitter.com,,,,,,,,,
abortion ireland min_retweets:1 until:2019-01-20 since:2018-12-21 -filter:replies,1086749090107535361,1547936148,2019-01-19T22:15:48,RockofLifeNI,"#Coombe #FakeNews 
Ireland's Pro-Abortion Politicians, the media & Abortion Campaigners have been bending the truth about the status of this baby's health all week. #Ireland #Abortion

#lies⬇️
https://www.irishtimes.com/news/social-affairs/woman-refused-abortion-says-she-was-told-of-fatal-abnormality-1.3763233?mode=amp

Reality ⬇️ https://twitter.com/rockprolife/status/1086749090107535361/photo/1",0,15,10,1,en,,,,Twitter for Android,http://twitter.com/download/android,Northern Ireland ,,,186588342,ᵁⁿᵇᵒʳⁿ ᴸⁱᵛᵉˢ ᴹᵃᵗᵗᵉʳ,0,"ɪ'ʟʟ ʜᴀᴠᴇ ᴀ ʟᴏᴛ ᴏꜰ ᴇxᴘʟᴀɪɴɪɴɢ ᴛᴏ ᴅᴏ ᴏɴ ᴊᴜᴅɢᴇᴍᴇɴᴛ ᴅᴀʏ, ʙᴜᴛ ᴠᴏᴛɪɴɢ ꜰᴏʀ ᴘᴏʟɪᴛɪᴄɪᴀɴꜱ ᴡʜᴏ ꜱᴜᴘᴘᴏʀᴛ ᴀʙᴏʀᴛɪᴏɴ ᴡᴏɴ'ᴛ ʙᴇ ᴏɴᴇ ᴏꜰ ᴛʜᴇᴍ. #RepealSection9 #VoteProlife #AE22",,https://pbs.twimg.com/profile_images/1504594149303009282/XkvXu63q_normal.jpg,37159,3763,4964,41401,22,2010-09-03T21:26:59,1283549219,scraping,1,,,,,,,,,2022-03-28T13:57:02.536982,https://twitter.com/RockofLifeNI/statuses/1086749090107535361,,,,,https://www.irishtimes.com/news/social-affairs/woman-refused-abortion-says-she-was-told-of-fatal-abnormality-1.3763233,irishtimes.com,https://pbs.twimg.com/media/DxToiJJXgAMDk50.jpg,1086749090107535361_DxToiJJXgAMDk50.jpg,photo,,,abortion|coombe|fakenews|ireland|lies,,,
abortion ireland min_retweets:1 until:2019-01-20 since:2018-12-21 -filter:replies,1086645226196946944,1547911385,2019-01-19T15:23:05,FelipeMurrelli,"President Trump yesterday speaking to the March for Life in Washington, has pledged he will veto any bill that promotes abortion, is it any wonder the morally  bankrupt msm hate him and are working tirelessly to impeach him, pity we don't have a Trump in stupid proabort Ireland.",,2,3,0,en,,,,Twitter for Android,http://twitter.com/download/android,Ireland,,,246842298,Philip Murrell,0,"Roman Catholic. Conservative. Pro-life. Lover of melodic music. Current affairs. Reading. Travelling. Retweets, etc. not endorsement. born August 14",,https://pbs.twimg.com/profile_images/1446592619551789058/V6q-4Pzm_normal.jpg,121005,6301,6175,36664,69,2011-02-03T15:46:15,1296747975,scraping,1,,,,,,,,,2022-03-28T13:57:02.537663,https://twitter.com/FelipeMurrelli/statuses/1086645226196946944,,,,,,,,,,,,,,,
abortion ireland min_retweets:1 until:2019-01-20 since:2018-12-21 -filter:replies,1086609872840474624,1547902956,2019-01-19T13:02:36,JacobMason,"DUP: “We want Northern Ireland treated the same as the U.K. — no exceptions!”
The U.K.: “Okay, so we’ll put you down for gay marriage and abortion, same as us.”
DUP: https://twitter.com/JacobMason/status/1086609872840474624/photo/1",0,2,5,0,en,,,,Twitter for iPhone,http://twitter.com/download/iphone,Greater Manchester,,,23429971,Jacob Mason,0,Constituency Support Manager for a @UKLabour MP 🌹| School Governor | Trustee @ClaytonHallUK | 🏴󠁧󠁢󠁳󠁣󠁴󠁿🇬🇧🏳️‍🌈,,https://pbs.twimg.com/profile_images/1493593890028412929/Kgj9FS5F_normal.jpg,7086,154,258,7791,4,2009-03-09T12:40:15,1236602415,scraping,1,,,,,,,,,2022-03-28T13:57:02.538657,https://twitter.com/JacobMason/statuses/1086609872840474624,GB,"Manchester, England",city,"[[-2.319934, 53.343623], [-2.147026, 53.343623], [-2.147026, 53.5702824], [-2.319934, 53.5702824]]",,,https://video.twimg.com/tweet_video/DxRp6QlWsAE_Ik0.mp4,1086609872840474624_DxRp6QlWsAE_Ik0.mp4,animated_gif,,,,,,
abortion ireland min_retweets:1 until:2019-01-20 since:2018-12-21 -filter:replies,1086566322828468225,1547892573,2019-01-19T10:09:33,joanneobrien2,"In Ireland there was a people’s assembly to look at the issue abortion and make proposals before they had a referendum. A much better way to do things than the ill-informed vote we had on Brexit. « Channel4News: “The distrust between the political class and the people is at its worst ever.”

Former Prime Minister Gordon Brown says he wants to “bring the people back into the process” of Brexit to decide whether “the situation has changed” from 2016. https://twitter.com/Channel4News/status/1086225740507566080/video/1 — https://twitter.com/Channel4News/status/1086225740507566080 »",0,8,18,2,en,,,,Twitter for iPhone,http://twitter.com/download/iphone,UK,,,203485509,Joanne O'Brien,0,"Photojournalist, Bloody Sunday book: A Matter of Minutes; work in National Portrait Gallery. Interests: current Palestine. Worries about the loonies in charge.",http://www.joanneobrien.co.uk,https://pbs.twimg.com/profile_images/729772792258899972/76Xv8CUV_normal.jpg,1063,223,404,1689,0,2010-10-16T11:26:36,1287228396,scraping,1,,,,,1086225740507566080,Channel4News,14569869,1547811372,2022-03-28T13:57:02.540479,https://twitter.com/joanneobrien2/statuses/1086566322828468225,,,,,https://twitter.com/Channel4News/status/1086225740507566080,twitter.com,https://video.twimg.com/amplify_video/1086225215925948417/vid/720x720/9asWRKfzcKAld2_8.mp4,1086225740507566080_9asWRKfzcKAld2_8.mp4,video,,,,,,
abortion ireland min_retweets:1 until:2019-01-20 since:2018-12-21 -filter:replies,1086540266293518337,1547886361,2019-01-19T08:26:01,freesafelegal,"Our Abortion Provision and Me panel discussion is happening on Monday, January 28th with speakers from @DW_Ireland and @merj_ireland https://www.facebook.com/events/1948483068593063/ #FreeSafeLegal #FreeSafeLegalLocal #NoOneLeftBehind https://twitter.com/freesafelegal/status/1086540266293518337/photo/1",0,10,11,0,en,,,,TweetDeck,https://about.twitter.com/products/tweetdeck,Ireland,,,1096875997,Abortion Rights IE,1,We are an all volunteer group of grassroots activists working on the campaign for #FreeSafeLegalLocal abortion in Ireland #Now4NI,http://www.abortionrightscampaign.ie,https://pbs.twimg.com/profile_images/1415967938927120385/ZLBB5f6R_normal.jpg,45790,26314,4966,18139,221,2013-01-17T01:39:13,1358386753,scraping,1,,,,,,,,,2022-03-28T13:57:02.541575,https://twitter.com/freesafelegal/statuses/1086540266293518337,,,,,https://www.facebook.com/events/1948483068593063/,facebook.com,https://pbs.twimg.com/media/DxONVa7XQAE0q5r.jpg,1086540266293518337_DxONVa7XQAE0q5r.jpg,photo,dw_ireland|merj_ireland,994278307058388999|970658893364912129,freesafelegal|freesafelegallocal|nooneleftbehind,,,
abortion ireland min_retweets:1 until:2019-01-20 since:2018-12-21 -filter:replies,1086413518465916928,1547856142,2019-01-19T00:02:22,TheScorcher,Great adoption story on @RTELateLateShow . Have to wonder when similar circumstances occur in the Ireland of 2019 will there be such a fantastically happy outcome for mother and child? Abortion is final. #prolife @SimonHarrisTD @campaignforleo,,6,6,0,en,,,,Twitter for Android,http://twitter.com/download/android,,,,275895522,Aidan Murphy,0,,,https://pbs.twimg.com/profile_images/1497209559814918144/0yvyzFKq_normal.jpg,2516,223,600,23766,0,2011-04-02T06:44:34,1301726674,scraping,1,,,,,,,,,2022-03-28T13:57:02.542067,https://twitter.com/TheScorcher/statuses/1086413518465916928,,,,,,,,,,rtelatelateshow|simonharristd,113447429|21117425,prolife,,,
abortion ireland min_retweets:1 until:2019-01-20 since:2018-12-21 -filter:replies,1086397746993614848,1547852381,2019-01-18T22:59:41,Pada1r,"Hearing Theresa May is about to axe the Human Rights act and everyone is up in arms.

I've got news for you - it was axed in 1967 when abortion was legalised and it was abolished in 2018 when Ireland did the same. 

If you support abortion, don't lecture about human rights.",,13,31,4,en,,,,Twitter Web Client,http://twitter.com,Scotland,,,809696599,Pàdair,0,"#Prolife #Catholic  If you disregard the very right to life itself, don't complain to me about your rights.  Likes & RT ≠ Endorsement",,https://pbs.twimg.com/profile_images/982197068545409024/K4A1HGb4_normal.jpg,35025,878,1086,29452,5,2012-09-07T22:11:45,1347055905,scraping,1,,,,,,,,,2022-03-28T13:57:02.542698,https://twitter.com/Pada1r/statuses/1086397746993614848,,,,,,,,,,,,,,,
abortion ireland min_retweets:1 until:2019-01-20 since:2018-12-21 -filter:replies,1086344978710913024,1547839800,2019-01-18T19:30:00,freesafelegal,"Allies from the North have stood alongside us for years. We have always been an all-island campaign & we fight for access for everyone who wants or needs an abortion on the island of Ireland. Accessible care must be accessible for all. #TheNorthIsNext 
https://www.independent.ie/irish-news/health/northern-women-will-pay-450-for-abortion-in-the-state-37723959.html https://twitter.com/freesafelegal/status/1086344978710913024/photo/1",0,8,28,1,en,,,,TweetDeck,https://about.twitter.com/products/tweetdeck,Ireland,,,1096875997,Abortion Rights IE,1,We are an all volunteer group of grassroots activists working on the campaign for #FreeSafeLegalLocal abortion in Ireland #Now4NI,http://www.abortionrightscampaign.ie,https://pbs.twimg.com/profile_images/1415967938927120385/ZLBB5f6R_normal.jpg,45790,26314,4966,18139,221,2013-01-17T01:39:13,1358386753,scraping,1,,,,,,,,,2022-03-28T13:57:02.543775,https://twitter.com/freesafelegal/statuses/1086344978710913024,,,,,https://www.independent.ie/irish-news/health/northern-women-will-pay-450-for-abortion-in-the-state-37723959.html,independent.ie,https://pbs.twimg.com/media/DxM0RDAUUAEdAnJ.jpg,1086344978710913024_DxM0RDAUUAEdAnJ.jpg,photo,,,thenorthisnext,,,
abortion ireland min_retweets:1 until:2019-01-20 since:2018-12-21 -filter:replies,1086311306993504256,1547831772,2019-01-18T17:16:12,Independent,Woman refused abortion by Dublin hospital despite Ireland introducing new law https://www.independent.co.uk/news/world/europe/woman-abortion-ireland-refused-dublin-coombe-hospital-law-change-referendum-a8734761.html?utm_medium=Social&utm_source=Twitter#Echobox=1547831192,0,6,4,1,en,,,,Echobox,https://www.echobox.com,"London, England",,,16973333,The Independent,1,"News, comment and features from The Independent. Try an ad-free experience with access to premium articles with our app: https://t.co/3cP3AmmEDy",http://independent.co.uk,https://pbs.twimg.com/profile_images/1500085652309917697/C6VhBAcV_normal.jpg,1244888,3702313,400,55,26226,2008-10-26T00:00:29,1224979229,scraping,1,,,,,,,,,2022-03-28T13:57:02.545590,https://twitter.com/Independent/statuses/1086311306993504256,,,,,https://www.independent.co.uk/news/world/europe/woman-abortion-ireland-refused-dublin-coombe-hospital-law-change-referendum-a8734761.html#Echobox=1547831192,independent.co.uk,,,,,,,,,
abortion ireland min_retweets:1 until:2019-01-20 since:2018-12-21 -filter:replies,1086301865401176064,1547829521,2019-01-18T16:38:41,ChuckDalldorf,"Abortion: Woman 'refused termination' at Dublin hospital https://www.bbc.com/news/world-europe-46912545
#Ireland #Dublin #EU #women #health #healthcare #politics #courts",0,1,0,0,en,,,,Twitter Web Client,http://twitter.com,,,,22794611,Chuck Dalldorf,0,MA in Diplomacy; retired California State Senate Staff; San Juan Island Fire & Rescue PIO & marine crew.  Funny guy & writer in the San Juan Islands.,,https://pbs.twimg.com/profile_images/1470110077675663362/IJzV30U-_normal.jpg,355687,4553,3975,55110,784,2009-03-04T16:24:59,1236183899,scraping,1,,,,,,,,,2022-03-28T13:57:02.547063,https://twitter.com/ChuckDalldorf/statuses/1086301865401176064,,,,,https://www.bbc.com/news/world-europe-46912545,bbc.com,,,,,,courts|dublin|eu|health|healthcare|ireland|politics|women,,,
abortion ireland min_retweets:1 until:2019-01-20 since:2018-12-21 -filter:replies,1086292244817199104,1547827228,2019-01-18T16:00:28,spikedonline,"Women across Europe are fighting for abortion rights and forcing lawmakers to take notice. The Isle of Man has just decriminalised abortion, and it’s time Britain and Northern Ireland followed suit, says @Ella_M_Whelan
https://www.spiked-online.com/2019/01/18/the-isle-of-mans-pro-choice-revolution/",0,8,17,15,en,,,,Buffer,https://buffer.com,,,,21201150,spiked,0,"The magazine that wants to change the world as well as report on it. For humanism, democracy and freedom. Donate: https://t.co/u7wIBGaDmS",http://www.spiked-online.com,https://pbs.twimg.com/profile_images/1041733669155753984/guR6RqL1_normal.jpg,52332,131901,386,175,1127,2009-02-18T14:40:27,1234968027,scraping,1,,,,,,,,,2022-03-28T13:57:02.548435,https://twitter.com/spikedonline/statuses/1086292244817199104,,,,,https://www.spiked-online.com/2019/01/18/the-isle-of-mans-pro-choice-revolution/,spiked-online.com,,,,ella_m_whelan,2193945487,,,,
abortion ireland min_retweets:1 until:2019-01-20 since:2018-12-21 -filter:replies,1086289776162922496,1547826639,2019-01-18T15:50:39,GonnaFry,"Woman denied abortion in Dublin despite new legislation #Ireland 

https://www.theguardian.com/world/2019/jan/18/woman-denied-abortion-in-dublin?CMP=Share_AndroidApp_Tweet",0,2,0,0,en,,,,Twitter for Android,http://twitter.com/download/android,"Alberta, Canada",,,744559800877342730,Eve O Destruction,0,Get vaccinated. 💛💙 The life you save may be your own. Working to stop #planetarydestruction for the sake of our children. I ❤️ solar power.,,https://pbs.twimg.com/profile_images/1504916954989047811/XbPVsE_0_normal.jpg,78350,1010,886,69234,73,2016-06-19T15:57:44,1466351864,scraping,1,,,,,,,,,2022-03-28T13:57:02.549028,https://twitter.com/GonnaFry/statuses/1086289776162922496,,,,,https://www.theguardian.com/world/2019/jan/18/woman-denied-abortion-in-dublin?CMP=Share_AndroidApp_Tweet,theguardian.com,,,,,,ireland,,,
abortion ireland min_retweets:1 until:2019-01-20 since:2018-12-21 -filter:replies,1086287628071325696,1547826127,2019-01-18T15:42:07,Jezebel,"Here's how a woman gets denied an abortion in Ireland, where it's now legal and free https://trib.al/djj4z0I https://twitter.com/Jezebel/status/1086287628071325696/photo/1",0,5,1,0,en,,,,SocialFlow,http://www.socialflow.com,,,,8192222,Jezebel,1,Sex. Celebrity. Politics. With Teeth,http://jezebel.com,https://pbs.twimg.com/profile_images/590580350532845568/rLGWqV5a_normal.png,118507,312504,45,192,5886,2007-08-14T22:57:34,1187132254,scraping,1,,,,,,,,,2022-03-28T13:57:02.549903,https://twitter.com/Jezebel/statuses/1086287628071325696,,,,,https://trib.al/djj4z0I,trib.al,https://pbs.twimg.com/media/DxNE1w2WsAAYZb0.jpg,1086287628071325696_DxNE1w2WsAAYZb0.jpg,photo,,,,,,
abortion ireland min_retweets:1 until:2019-01-20 since:2018-12-21 -filter:replies,1086279624160567297,1547824219,2019-01-18T15:10:19,Humanists_UK,The people of Ireland voted by a landslide to legalise abortion. Women's reproductive rights are human rights.  https://www.theguardian.com/world/2019/jan/18/woman-denied-abortion-in-dublin,0,9,28,1,en,,,,Twitter Web Client,http://twitter.com,London,,,46686058,Humanists UK,1,We advance free thinking and promote humanism to create a tolerant society where rational thinking and kindness prevail. Registered charity no. 285987.,http://humanists.uk,https://pbs.twimg.com/profile_images/1504461056411848719/VV76E9Zj_normal.jpg,57432,110019,3188,15322,1177,2009-06-12T16:18:39,1244823519,scraping,1,,,,,,,,,2022-03-28T13:57:02.550497,https://twitter.com/Humanists_UK/statuses/1086279624160567297,,,,,https://www.theguardian.com/world/2019/jan/18/woman-denied-abortion-in-dublin,theguardian.com,,,,,,,,,
abortion ireland min_retweets:1 until:2019-01-20 since:2018-12-21 -filter:replies,1086269082947719168,1547821705,2019-01-18T14:28:25,NCBCenter,"Abortion is legal is Ireland, but doctors aren’t exactly lining up to do them: https://aleteia.org/2019/01/11/abortion-is-legal-in-ireland-but-doctors-are-not-signing-up-to-perform-them/ @AleteiaEN @seamus6346 @ExposeMediaBias #Humanlifeaction #bieothics",0,3,3,0,en,,,,Twitter Web Client,http://twitter.com,"Philadelphia, PA",,,800735177815179265,The National Catholic Bioethics Center,0,Defending the dignity of the human person in healthcare and the life sciences since 1972.,http://ncbcenter.org,https://pbs.twimg.com/profile_images/1418222347073462282/U5jl7DS-_normal.png,17320,1881,359,2079,36,2016-11-21T16:18:38,1479745118,scraping,1,,,,,,,,,2022-03-28T13:57:02.551078,https://twitter.com/NCBCenter/statuses/1086269082947719168,,,,,https://aleteia.org/2019/01/11/abortion-is-legal-in-ireland-but-doctors-are-not-signing-up-to-perform-them/,aleteia.org,,,,aleteiaen|exposemediabias|seamus6346,289981219|2584212787|455172741,bieothics|humanlifeaction,,,
abortion ireland min_retweets:1 until:2019-01-20 since:2018-12-21 -filter:replies,1086228248080670720,1547811970,2019-01-18T11:46:10,MickBarryTD,Woman ‘refused’ abortion will travel to United Kingdom https://www.irishtimes.com/news/social-affairs/woman-refused-abortion-will-travel-to-united-kingdom-1.3762063. “This is not what the people of Ireland voted for. This is not what I voted for” #RepealedThe8th,0,16,25,2,en,,,,Twitter for iPhone,http://twitter.com/download/iphone,,,,2575040162,Mick Barry TD,1,"Workers of all countries unite, you have nothing to lose but your chains. Socialist Party & Solidarity TD for Cork North Central. Retweets not an endorsement.",,https://pbs.twimg.com/profile_images/1445421476459462668/dkZHRkeD_normal.jpg,4631,11234,4398,215,112,2014-06-18T15:27:15,1403105235,scraping,1,,,,,,,,,2022-03-28T13:57:02.552410,https://twitter.com/MickBarryTD/statuses/1086228248080670720,,,,,https://www.irishtimes.com/news/social-affairs/woman-refused-abortion-will-travel-to-united-kingdom-1.3762063,irishtimes.com,,,,,,repealedthe8th,,,
abortion ireland min_retweets:1 until:2019-01-20 since:2018-12-21 -filter:replies,1086208947969802240,1547807368,2019-01-18T10:29:28,ianpatterson99,"Ireland confirms women from the North will be able to get abortions in the south, but will have to pay a €450 fee.  http://pressreader.com/@Ian_Patterson7369414/csb_CsmOZXZyrD8qws8dK3mqy66uJI3rTpzXnDRSLwNpY8e2vw2BWul0Dj7UUbzFFL_Z",0,1,0,1,en,,,,Twitter for iPad,http://twitter.com/#!/download/ipad,"London, England",,,14441334,Ian Patterson,0,"𝚆𝚎 𝚕𝚒𝚟𝚎 𝚒𝚗 𝚊 𝚏𝚞𝚗𝚗𝚢 𝚠𝚘𝚛𝚕𝚍, 𝚜𝚘 𝚓𝚞𝚜𝚝 𝚖𝚊𝚔𝚒𝚗𝚐 𝚝𝚑𝚎 𝚖𝚘𝚜𝚝 𝚘𝚏 𝚒𝚝 𝚘𝚗𝚎 𝚃𝚠𝚎𝚎𝚝 𝚊𝚝 𝚊 𝚝𝚒𝚖𝚎. 𝙻𝚒𝚋𝚎𝚛𝚊𝚕.",https://linktr.ee/Ianpatterson,https://pbs.twimg.com/profile_images/1866676974/IMG_2018_normal.jpg,370528,2517,4236,16566,235,2008-04-19T07:49:52,1208591392,scraping,1,,,,,,,,,2022-03-28T13:57:02.553041,https://twitter.com/ianpatterson99/statuses/1086208947969802240,,,,,http://pressreader.com/%40Ian_Patterson7369414/csb_CsmOZXZyrD8qws8dK3mqy66uJI3rTpzXnDRSLwNpY8e2vw2BWul0Dj7UUbzFFL_Z,pressreader.com,,,,ian_patterson7369414,,,,,
abortion ireland min_retweets:1 until:2019-01-20 since:2018-12-21 -filter:replies,1086205647882997760,1547806581,2019-01-18T10:16:21,hannahwilson_3,"Denied an #abortion, told to wait and see if she miscarried, now forced to go to the UK- this case shows how, even if laws are in place, #womensrights and #womenshealth are at risk if the law isn't applied properly. Unacceptable. #repealedThe8th #ireland https://bit.ly/2Csxro3",0,6,6,0,en,,,,Twitter Web Client,http://twitter.com,London,,,250124554,Hannah Wilson,0,"Pupil barrister at @GoldsmithChambs, interested in criminal law, human rights, access to justice, and women's rights.",,https://pbs.twimg.com/profile_images/1173839161293492224/3RByPrZ3_normal.jpg,234,298,825,1385,2,2011-02-10T13:35:17,1297344917,scraping,1,,,,,,,,,2022-03-28T13:57:02.553654,https://twitter.com/hannahwilson_3/statuses/1086205647882997760,,,,,https://bit.ly/2Csxro3,bit.ly,,,,,,abortion|ireland|repealedthe8th|womenshealth|womensrights,,,
abortion ireland min_retweets:1 until:2019-01-20 since:2018-12-21 -filter:replies,1086186431884771329,1547802000,2019-01-18T09:00:00,AmnestyIreland,"Impact: After decades of campaigning, Ireland voted to repeal it’s ban on abortion.

Why it's not enough: Argentina’s Senate rejected a law that would've saved women’s lives by legalizing abortion during first 14 wks of pregnancy. The campaign continues.

#repealedthe8th",0,2,2,0,en,,,,Twitter for Advertisers.,https://ads-api.twitter.com,"Dublin, Ireland",,,16309025,Amnesty Ireland,1,"Ireland's largest human rights organisation, 20,000 strong. Freedom. Justice. Equality. Let's get to work!",http://www.amnesty.ie,https://pbs.twimg.com/profile_images/1503340956556345345/jNgsBDXe_normal.png,19628,34411,4612,6628,531,2008-09-16T10:24:40,1221560680,scraping,1,,,,,,,,,2022-03-28T13:57:03.385397,https://twitter.com/AmnestyIreland/statuses/1086186431884771329,,,,,,,,,,,,repealedthe8th,,,
abortion ireland min_retweets:1 until:2019-01-20 since:2018-12-21 -filter:replies,1086185011026554881,1547801661,2019-01-18T08:54:21,jadeswilson,"Woman refused abortion will travel to United Kingdom. 

Not even a month into abortion ‘access’ in Ireland and this has happened. 

This is not what we voted for.  https://www.irishtimes.com/news/social-affairs/woman-refused-abortion-will-travel-to-united-kingdom-1.3762063",0,24,76,0,en,,,,Twitter for iPhone,http://twitter.com/download/iphone,Ireland,,,111287761,Jade Wilson,1,Reporter @IrishTimes | Got a story? jadewilson@irishtimes.com Threema ID: 62ZH83MU | Previously: @Business @NewstalkFM @GCNMag,https://www.irishtimes.com/profile/jade-wilson-7.5488442,https://pbs.twimg.com/profile_images/1466147448183836672/HmPnZO9v_normal.jpg,10698,10528,3068,65280,15,2010-02-04T12:00:35,1265284835,scraping,1,,,,,,,,,2022-03-28T13:57:03.387508,https://twitter.com/jadeswilson/statuses/1086185011026554881,,,,,https://www.irishtimes.com/news/social-affairs/woman-refused-abortion-will-travel-to-united-kingdom-1.3762063,irishtimes.com,,,,,,,,,
abortion ireland min_retweets:1 until:2019-01-20 since:2018-12-21 -filter:replies,1086170244241149952,1547798140,2019-01-18T07:55:40,PadraigSagart,"Abortion practitioners used partial - birth abortions to harvest parts of the babies' bodies to sell them for profit to research companies What an abomination! Does Ireland's new abortion ""law"" permit this trade in aborted babies' body parts? « CtrMedProgress: BREAKING: Federal 5th Circuit Appeals Court debunks @PPact smears, vindicates CMP's undercover videos, finds @PPFA uses criminal partial-birth abortions to harvest marketable baby parts, rules TX may strip taxpayer subsidies from @PPGulfCoast

#PPSellsBabyParts #ReleaseTheVideos https://twitter.com/CtrMedProgress/status/1086114052701646848/photo/1 — https://twitter.com/CtrMedProgress/status/1086114052701646848 »",0,12,10,0,en,,,,Twitter for Android,http://twitter.com/download/android,Áth Cliath Dublin ,,,271122311,Pádraig Ó Cochláin,0,"Peacach, Gael, Sagart, Traveller on life's pilgrimage seeking the kingdom of God aiming to do some good for people on the road",,https://pbs.twimg.com/profile_images/1285972399/Padraig_PIC_FD_normal.jpg,48580,1553,500,131,27,2011-03-23T22:18:34,1300918714,scraping,1,,,,,1086114052701646848,CtrMedProgress,3231038202,1547784743,2022-03-28T13:57:03.389567,https://twitter.com/PadraigSagart/statuses/1086170244241149952,,,,,https://twitter.com/CtrMedProgress/status/1086114052701646848,twitter.com,https://pbs.twimg.com/media/DxKmZ8dX4AAxErD.jpg,1086114052701646848_DxKmZ8dX4AAxErD.jpg,photo,ppact|ppfa|ppgulfcoast,22162854|402957663|381159708,ppsellsbabyparts|releasethevideos,,,
